### ISSUE TITLE
Cilium + IPVS proxy mode pod-to-NodePort service connectivity issue

### ISSUE THREAD

**Issue by rastislavs** [kubermatic/kubermatic#8767]
In a KKP user cluster with CIlium CNI and IPVS kube-proxy mode, the following issue has been identified in the pod-to-NodePort service traffic:

- in a multi-node cluster, deploy a NodePort service with multiple pod backends running on different nodes
- start a client pod on one of the nodes
- try connectiong to `<node-ip>:<NodePort>`, with the `<node-ip>` being the internal IP of the node where the client pod is running
- the connection works if it is load-balanced to a local pod
- the connection does not work if it is load-balanced to a pod running on a remote node
- using `<node-ip>` of remote nodes works fine, as well as using external IP of the local or remote nodes

The issue can be reproduced e.g. in AWS or Azure. It only affects IPVS proxy mode, iptables and ebpf (kube-proxy-replacement) is working fine.

**Comment by rastislavs** [comment]
Service:
```
NAME               TYPE       CLUSTER-IP      EXTERNAL-IP   PORT(S)         AGE
nginx-deployment   NodePort   10.240.21.241   <none>        80:30866/TCP    81m
```
Nodes:
```
NAME                                             STATUS   ROLES    AGE    VERSION   INTERNAL-IP     EXTERNAL-IP     OS-IMAGE             KERNEL-VERSION    CONTAINER-RUNTIME
ip-172-31-87-192.eu-central-1.compute.internal   Ready    <none>   127m   v1.21.8   172.31.87.192   <redacted>     Ubuntu 20.04.3 LTS   5.11.0-1027-aws   containerd://1.4.12
ip-172-31-87-80.eu-central-1.compute.internal    Ready    <none>   127m   v1.21.8   172.31.87.80    <redacted>     Ubuntu 20.04.3 LTS   5.11.0-1027-aws   containerd://1.4.12
```
Client pod `default/tmp-shell` IP `172.25.0.48` running on the node `172.31.87.80` performing a non-working connection going to a backend on a remote node (`curl 172.31.87.80:30866`):

`hubble observe` on the local node (`172.31.87.80`):
```
Jan 21 14:58:16.977: default/tmp-shell:41540 -> 172.31.87.80:30866 to-stack FORWARDED (TCP Flags: SYN)
Jan 21 14:58:16.977: 172.31.87.80:20432 <> default/nginx-deployment-66b6c48dd5-tj9z2:80 to-overlay FORWARDED (TCP Flags: SYN)
```

`hubble observe` on the target node - where the backend pod is running (`172.31.87.80`):
```
Jan 21 15:03:04.502: 172.31.87.80:20432 -> default/nginx-deployment-66b6c48dd5-tj9z2:80 to-endpoint FORWARDED (TCP Flags: SYN)
Jan 21 15:03:04.502: 172.31.87.80:20432 <- default/nginx-deployment-66b6c48dd5-tj9z2:80 to-stack FORWARDED (TCP Flags: SYN, ACK)
```

This shows that the SYN packet was SNATed on the client node to the node IP (`172.31.87.80`). The SYN packet was delivered to the target node and the target pod, the reply (SYN+ACK) was generated, but was not delivered back to the client node.

This can be also confirmed with tcpdump, on the client node we only see SYN packet going out:
```
$ tcpdump -ni any port 20432
15:11:53.075453 IP 172.31.87.80.20432 > 172.25.1.155.80: Flags [S], seq 319902883, win 62377, options [mss 8911,sackOK,TS val 2698378949 ecr 0,nop,wscale 7], length 0
```

On the target node we see SYN and SYN+ACK going back:
```
$ tcpdump -ni any port 20432
15:11:53.074880 IP 172.31.87.80.20432 > 172.25.1.155.80: Flags [S], seq 319902883, win 62377, options [mss 8911,sackOK,TS val 2698378949 ecr 0,nop,wscale 7], length 0
15:11:53.075132 IP 172.25.1.155.80 > 172.31.87.80.20432: Flags [S.], seq 37009425, ack 319902884, win 62293, options [mss 8911,sackOK,TS val 3252191153 ecr 2698313666,nop,wscale 7], length 0
```

What is important, on the target node, the SYN packets are incoming via the the overlay (`cilium_vxlan`) interface:
```
$ tcpdump -ni cilium_vxlan port 12285
15:11:53.074880 IP 172.31.87.80.20432 > 172.25.1.155.80: Flags [S], seq 319902883, win 62377, options [mss 8911,sackOK,TS val 2698378949 ecr 0,nop,wscale 7], length 0
```
and SYN+ACK is outgoing via main the node interface (`ens5`):
```
$ tcpdump -ni ens5 port 12285
15:11:53.075132 IP 172.25.1.155.80 > 172.31.87.80.20432: Flags [S.], seq 37009425, ack 319902884, win 62293, options [mss 8911,sackOK,TS val 3252191153 ecr 2698313666,nop,wscale 7], length 0
```
So the routing here is asymmetric, client node -> target node goes via VXLAN overlay, target node -> client node goes via node network. On this way, the SYN+ACK is lost, most likely filtered by the underlay network layer because of SYN not seen.

The SNAT on the client node is performed by the KUBE-POSTROUTING chain (line numbers 3 and 4):
```
Chain KUBE-POSTROUTING (1 references)
num   pkts bytes target     prot opt in     out     source               destination         
1        0     0 MASQUERADE  all  --  *      *       0.0.0.0/0            0.0.0.0/0            /* Kubernetes endpoints dst ip:port, source ip for solving hairpin purpose */ match-set KUBE-LOOP-BACK dst,dst,src
2       65  4324 RETURN     all  --  *      *       0.0.0.0/0            0.0.0.0/0            mark match ! 0x4000/0x4000
3        2   120 MARK       all  --  *      *       0.0.0.0/0            0.0.0.0/0            MARK xor 0x4000
4        2   120 MASQUERADE  all  --  *      *       0.0.0.0/0            0.0.0.0/0            /* kubernetes service traffic requiring SNAT */ random-fully
```

**Comment by rastislavs** [comment]
For comparison, working case: Cilium + iptables:

Client pod `default/tmp-shell` IP `172.25.1.5` running on the node `172.31.87.144` performing request `curl 172.31.87.144:31299`.

`hubble observe` on the local node ( `172.31.87.144`):
```
Jan 21 15:50:57.472: default/tmp-shell:54564 -> 172.31.87.144:31299 to-stack FORWARDED (TCP Flags: SYN)
Jan 21 15:50:57.472: 172.25.1.176:54564 <> default/nginx-deployment-66b6c48dd5-vs776:80 to-overlay FORWARDED (TCP Flags: SYN)
Jan 21 15:50:57.473: default/tmp-shell:54564 <- 172.31.87.144:31299 to-endpoint FORWARDED (TCP Flags: SYN, ACK)
```

`hubble observe` on the target node - where the backend pod is running (172.31.87.149):
```
Jan 21 15:50:57.471: 172.25.1.176:54564 -> default/nginx-deployment-66b6c48dd5-vs776:80 to-endpoint FORWARDED (TCP Flags: SYN)
Jan 21 15:50:57.471: default/nginx-deployment-66b6c48dd5-vs776:80 <> 172.25.1.176:54564 to-overlay FORWARDED (TCP Flags: SYN, ACK)
```

In this case, both SYN and SYN+ACK reply went via the overlay. In this case, the SYN was SNATed on the client node to the `cilium_host` interface IP address `172.25.1.176`.

In this case, the SNAT is performed by the `CILIUM_POST_nat` chain (hits on the line number 5):
```
Chain CILIUM_POST_nat (1 references)
num   pkts bytes target     prot opt in     out     source               destination         
1       38  2376 MASQUERADE  all  --  *      !cilium_+  172.25.1.0/24       !172.25.1.0/24        /* cilium masquerade non-cluster */
2        3   180 ACCEPT     all  --  *      *       0.0.0.0/0            0.0.0.0/0            mark match 0xa00/0xe00 /* exclude proxy return traffic from masquerade */
3       28  1320 SNAT       all  --  *      cilium_host !172.25.1.0/24       !172.25.1.0/24        /* cilium host->cluster masquerade */ to:172.25.1.176
4        0     0 SNAT       all  --  *      cilium_host  127.0.0.1            0.0.0.0/0            /* cilium host->cluster from 127.0.0.1 masquerade */ to:172.25.1.176
5       65  3900 SNAT       all  --  *      cilium_host  0.0.0.0/0            0.0.0.0/0            mark match 0xf00/0xf00 ctstate DNAT /* hairpin traffic that originated from a local pod */ to:172.25.1.176
```
